{
  "schema_version": "3.0.0-draft",
  "artifact_kind": "runtime_identity_pair",
  "candidate_id": "candidate_025",
  "release_id": "app-sha256:f88ae3a638651a182392c2b3e6a4d2937dd00f597c43efc6ae0e176abaa3b99c",
  "run_id": "local-run-73d8eaec3a8b5c97",
  "operator_run_token": "local_token_73d8eaec3a8b5c97",
  "runtime_identity_start": {
    "package_name": "com.scpc.deliveryagent",
    "version_name": "1.0.0",
    "version_code": "1",
    "signing_certificate_sha256": "f75fb6d157734f4ef4f1e777c193a0bfe54e0bfb9bc369113971fe1001489919",
    "app_release_sha256": "f88ae3a638651a182392c2b3e6a4d2937dd00f597c43efc6ae0e176abaa3b99c",
    "source_archive_sha256": "eb9aa78e40641c74b7a554868102fb6e56dd2632c47c14951c6c98cddc03b690",
    "model_configured": false,
    "probe_contract_profile": "DACON_SIGNED_RUNNER_PROTECTED_COMPONENT_V3_DRAFT",
    "cumulative_invocations": 0
  },
  "runtime_identity_end": {
    "package_name": "com.scpc.deliveryagent",
    "version_name": "1.0.0",
    "version_code": "1",
    "signing_certificate_sha256": "f75fb6d157734f4ef4f1e777c193a0bfe54e0bfb9bc369113971fe1001489919",
    "app_release_sha256": "f88ae3a638651a182392c2b3e6a4d2937dd00f597c43efc6ae0e176abaa3b99c",
    "source_archive_sha256": "eb9aa78e40641c74b7a554868102fb6e56dd2632c47c14951c6c98cddc03b690",
    "model_configured": false,
    "probe_contract_profile": "DACON_SIGNED_RUNNER_PROTECTED_COMPONENT_V3_DRAFT",
    "cumulative_invocations": 0
  }
}
